{
  "detectors": "408ceeb0b5e1",
  "measures": {
    "agent_seconds": "Agent time",
    "avoidable_share": "Avoidable share of generated tokens",
    "confident_findings": "Confident waste findings",
    "edits_validated_share": "Edits covered by a later validation run",
    "flow_efficiency_time": "Flow efficiency (time)",
    "flow_efficiency_tokens": "Flow efficiency (tokens)",
    "generated_tokens": "Generated tokens",
    "rework_cycles": "Rework cycles (same failure)",
    "risk_findings": "Risk findings",
    "ter": "Token Efficiency Ratio",
    "uncertain_findings": "Uncertain findings (waste until verified)",
    "unresolved_failures_at_end": "Failing checks never seen passing again",
    "unvalidated_edits_at_end": "Edits no validation run covered",
    "unverified_waste_share": "Avoidable plus unverified share of generated tokens",
    "value_adding_share": "Value-adding share of generated tokens",
    "wip_peak": "Peak WIP"
  },
  "schema": "ter.control-measures/1",
  "sessions": [
    {
      "session": "sample-session-001",
      "started_at": "2026-01-15T10:00:00+00:00",
      "values": {
        "agent_seconds": 19.0,
        "avoidable_share": 0.056604,
        "confident_findings": 1.0,
        "edits_validated_share": 1.0,
        "flow_efficiency_time": 0.926316,
        "flow_efficiency_tokens": 0.784067,
        "generated_tokens": 477.0,
        "rework_cycles": 0.0,
        "risk_findings": 0.0,
        "ter": 0.806,
        "uncertain_findings": 1.0,
        "unresolved_failures_at_end": 0.0,
        "unvalidated_edits_at_end": 0.0,
        "unverified_waste_share": 0.215933,
        "value_adding_share": 0.360587,
        "wip_peak": 1.0
      }
    },
    {
      "session": "golden-explore",
      "started_at": "2026-03-02T09:00:03+00:00",
      "values": {
        "agent_seconds": 57.0,
        "avoidable_share": 0.128947,
        "confident_findings": 3.0,
        "edits_validated_share": 1.0,
        "flow_efficiency_time": 0.578947,
        "flow_efficiency_tokens": 0.792105,
        "generated_tokens": 380.0,
        "rework_cycles": 0.0,
        "risk_findings": 0.0,
        "ter": 0.6491,
        "uncertain_findings": 2.0,
        "unresolved_failures_at_end": 0.0,
        "unvalidated_edits_at_end": 0.0,
        "unverified_waste_share": 0.207895,
        "value_adding_share": 0.547368,
        "wip_peak": 5.0
      }
    },
    {
      "session": "golden-handoff",
      "started_at": "2026-03-02T09:00:03+00:00",
      "values": {
        "agent_seconds": 33.0,
        "avoidable_share": 0.0,
        "confident_findings": 0.0,
        "edits_validated_share": 0.0,
        "flow_efficiency_time": 0.818182,
        "flow_efficiency_tokens": 0.848485,
        "generated_tokens": 198.0,
        "rework_cycles": 0.0,
        "risk_findings": 1.0,
        "ter": 0.7,
        "uncertain_findings": 1.0,
        "unresolved_failures_at_end": 0.0,
        "unvalidated_edits_at_end": 1.0,
        "unverified_waste_share": 0.151515,
        "value_adding_share": 0.40404,
        "wip_peak": 3.0
      }
    },
    {
      "session": "golden-rework",
      "started_at": "2026-03-02T09:00:03+00:00",
      "values": {
        "agent_seconds": 45.0,
        "avoidable_share": 0.232323,
        "confident_findings": 1.0,
        "edits_validated_share": 1.0,
        "flow_efficiency_time": 0.8,
        "flow_efficiency_tokens": 0.767677,
        "generated_tokens": 396.0,
        "rework_cycles": 1.0,
        "risk_findings": 0.0,
        "ter": 0.8049,
        "uncertain_findings": 0.0,
        "unresolved_failures_at_end": 0.0,
        "unvalidated_edits_at_end": 0.0,
        "unverified_waste_share": 0.232323,
        "value_adding_share": 0.378788,
        "wip_peak": 2.0
      }
    },
    {
      "session": "golden-shift",
      "started_at": "2026-03-02T09:00:03+00:00",
      "values": {
        "agent_seconds": 27.0,
        "avoidable_share": 0.261283,
        "confident_findings": 1.0,
        "edits_validated_share": 1.0,
        "flow_efficiency_time": 0.888889,
        "flow_efficiency_tokens": 0.738717,
        "generated_tokens": 421.0,
        "rework_cycles": 0.0,
        "risk_findings": 2.0,
        "ter": 0.9316,
        "uncertain_findings": 0.0,
        "unresolved_failures_at_end": 0.0,
        "unvalidated_edits_at_end": 0.0,
        "unverified_waste_share": 0.261283,
        "value_adding_share": 0.515439,
        "wip_peak": 3.0
      }
    },
    {
      "session": "golden-iterate",
      "started_at": "2026-03-05T10:00:03+00:00",
      "values": {
        "agent_seconds": 39.0,
        "avoidable_share": 0.0,
        "confident_findings": 0.0,
        "edits_validated_share": 1.0,
        "flow_efficiency_time": 1.0,
        "flow_efficiency_tokens": 1.0,
        "generated_tokens": 320.0,
        "rework_cycles": 0.0,
        "risk_findings": 0.0,
        "ter": 0.6422,
        "uncertain_findings": 0.0,
        "unresolved_failures_at_end": 0.0,
        "unvalidated_edits_at_end": 0.0,
        "unverified_waste_share": 0.0,
        "value_adding_share": 0.675,
        "wip_peak": 2.0
      }
    },
    {
      "session": "golden-lean-mix",
      "started_at": "2026-03-05T10:00:03+00:00",
      "values": {
        "agent_seconds": 84.0,
        "avoidable_share": 0.239598,
        "confident_findings": 4.0,
        "edits_validated_share": 1.0,
        "flow_efficiency_time": 0.791667,
        "flow_efficiency_tokens": 0.760402,
        "generated_tokens": 697.0,
        "rework_cycles": 0.0,
        "risk_findings": 1.0,
        "ter": 0.7713,
        "uncertain_findings": 0.0,
        "unresolved_failures_at_end": 1.0,
        "unvalidated_edits_at_end": 0.0,
        "unverified_waste_share": 0.239598,
        "value_adding_share": 0.493544,
        "wip_peak": 8.0
      }
    },
    {
      "session": "session-test-001",
      "started_at": "2026-04-01T10:00:00+00:00",
      "values": {
        "agent_seconds": 30.0,
        "avoidable_share": 0.0,
        "confident_findings": 0.0,
        "edits_validated_share": 0.0,
        "flow_efficiency_time": 1.0,
        "flow_efficiency_tokens": 1.0,
        "generated_tokens": 420.0,
        "rework_cycles": 0.0,
        "risk_findings": 3.0,
        "ter": 1.0,
        "uncertain_findings": 0.0,
        "unresolved_failures_at_end": 0.0,
        "unvalidated_edits_at_end": 2.0,
        "unverified_waste_share": 0.0,
        "value_adding_share": 0.678571,
        "wip_peak": 3.0
      }
    }
  ]
}
